
=== EXP06c (5-fold brute-force CV2) ===

Total rows: 2976
Features: 1662

=== Brute-force CV2 fold 1 | target=0.16-0.20 ===
========================================================================
Brute-force CV2: min_frac=0.16, max_frac=0.20, target rows [476, 595]
BEST: test strains=2, test pairs=434, kept=491, dropped=371

=== Brute-force CV2 fold 2 | target=0.18-0.22 ===
========================================================================
Brute-force CV2: min_frac=0.18, max_frac=0.22, target rows [536, 655]
BEST: test strains=3, test pairs=546, kept=652, dropped=428

=== Brute-force CV2 fold 3 | target=0.20-0.24 ===
========================================================================
Brute-force CV2: min_frac=0.20, max_frac=0.24, target rows [595, 714]
BEST: test strains=3, test pairs=546, kept=652, dropped=428

=== Brute-force CV2 fold 4 | target=0.22-0.26 ===
========================================================================
Brute-force CV2: min_frac=0.22, max_frac=0.26, target rows [655, 774]
BEST: test strains=3, test pairs=587, kept=700, dropped=432

=== Brute-force CV2 fold 5 | target=0.24-0.28 ===
========================================================================
Brute-force CV2: min_frac=0.24, max_frac=0.28, target rows [714, 833]
BEST: test strains=3, test pairs=523, kept=765, dropped=581

########################################################################
########## OUTER FOLD 1/5 ##########
########################################################################

--- Inner CV search (32 configs) ---
Best ACC: 0.785
Best params: {'boosting_type': 'gbdt', 'learning_rate': 0.03, 'max_depth': 3, 'num_leaves': 7, 'min_data_in_leaf': 200, 'feature_fraction': 0.4, 'bagging_fraction': 0.8, 'bagging_freq': 1, 'lambda_l2': 32.882872075450805, 'lambda_l1': 0.5, 'max_bin': 127, 'min_gain_to_split': 0.05}

=== OUTER FOLD 1 RESULTS ===
AUC      : 0.545
Acc      : 0.503
F1-macro : 0.498
F1-w     : 0.491

Report:
               precision    recall  f1-score   support

  antagonism       0.45      0.70      0.55       214
     synergy       0.60      0.35      0.45       277

    accuracy                           0.50       491
   macro avg       0.53      0.53      0.50       491
weighted avg       0.54      0.50      0.49       491


########################################################################
########## OUTER FOLD 2/5 ##########
########################################################################

--- Inner CV search (32 configs) ---
Best ACC: 0.767
Best params: {'boosting_type': 'gbdt', 'learning_rate': 0.03, 'max_depth': 3, 'num_leaves': 7, 'min_data_in_leaf': 200, 'feature_fraction': 0.3, 'bagging_fraction': 0.8, 'bagging_freq': 1, 'lambda_l2': 33.47293451760556, 'lambda_l1': 0.0, 'max_bin': 127, 'min_gain_to_split': 0.1}

=== OUTER FOLD 2 RESULTS ===
AUC      : 0.580
Acc      : 0.526
F1-macro : 0.518
F1-w     : 0.512

Report:
               precision    recall  f1-score   support

  antagonism       0.48      0.73      0.58       293
     synergy       0.62      0.36      0.46       359

    accuracy                           0.53       652
   macro avg       0.55      0.54      0.52       652
weighted avg       0.56      0.53      0.51       652


########################################################################
########## OUTER FOLD 3/5 ##########
########################################################################

--- Inner CV search (32 configs) ---
Best ACC: 0.768
Best params: {'boosting_type': 'gbdt', 'learning_rate': 0.03, 'max_depth': 3, 'num_leaves': 9, 'min_data_in_leaf': 200, 'feature_fraction': 0.3, 'bagging_fraction': 0.6, 'bagging_freq': 1, 'lambda_l2': 35.53622706850113, 'lambda_l1': 0.5, 'max_bin': 63, 'min_gain_to_split': 0.1}

=== OUTER FOLD 3 RESULTS ===
AUC      : 0.574
Acc      : 0.535
F1-macro : 0.528
F1-w     : 0.522

Report:
               precision    recall  f1-score   support

  antagonism       0.49      0.74      0.59       293
     synergy       0.63      0.37      0.47       359

    accuracy                           0.54       652
   macro avg       0.56      0.55      0.53       652
weighted avg       0.57      0.54      0.52       652


########################################################################
########## OUTER FOLD 4/5 ##########
########################################################################

--- Inner CV search (32 configs) ---
Best ACC: 0.774
Best params: {'boosting_type': 'gbdt', 'learning_rate': 0.03, 'max_depth': 3, 'num_leaves': 9, 'min_data_in_leaf': 200, 'feature_fraction': 0.3, 'bagging_fraction': 0.6, 'bagging_freq': 1, 'lambda_l2': 31.31853976973867, 'lambda_l1': 0.1, 'max_bin': 63, 'min_gain_to_split': 0.05}

=== OUTER FOLD 4 RESULTS ===
AUC      : 0.556
Acc      : 0.527
F1-macro : 0.519
F1-w     : 0.514

Report:
               precision    recall  f1-score   support

  antagonism       0.49      0.72      0.58       319
     synergy       0.61      0.37      0.46       381

    accuracy                           0.53       700
   macro avg       0.55      0.54      0.52       700
weighted avg       0.55      0.53      0.51       700


########################################################################
########## OUTER FOLD 5/5 ##########
########################################################################

--- Inner CV search (32 configs) ---
Best ACC: 0.754
Best params: {'boosting_type': 'gbdt', 'learning_rate': 0.03, 'max_depth': 3, 'num_leaves': 9, 'min_data_in_leaf': 200, 'feature_fraction': 0.4, 'bagging_fraction': 0.8, 'bagging_freq': 1, 'lambda_l2': 59.700993828377705, 'lambda_l1': 0.5, 'max_bin': 127, 'min_gain_to_split': 0.1}

=== OUTER FOLD 5 RESULTS ===
AUC      : 0.633
Acc      : 0.588
F1-macro : 0.587
F1-w     : 0.586

Report:
               precision    recall  f1-score   support

  antagonism       0.57      0.66      0.61       375
     synergy       0.61      0.52      0.56       390

    accuracy                           0.59       765
   macro avg       0.59      0.59      0.59       765
weighted avg       0.59      0.59      0.59       765


========================================================================
=== SUMMARY ACROSS 5 CV2 FOLDS ===
roc_auc_mean=0.5772  roc_auc_std=0.0304
accuracy_mean=0.5360  accuracy_std=0.0283
f1_macro_mean=0.5298  f1_macro_std=0.0301
f1_weighted_mean=0.5248  f1_weighted_std=0.0323

=== EXP06c DONE (5-fold brute-force CV2) ===

